{
  "$ref": "#/definitions/projects",
  "definitions": {
    "projects": {
      "type": "object",
      "properties": {
        "name": {
          "type": "string"
        },
        "description": {
          "type": "string"
        },
        "tech": {
          "type": "array",
          "items": {
            "type": "string"
          }
        },
        "link": {
          "type": "string",
          "format": "uri"
        },
        "github": {
          "type": "string",
          "format": "uri"
        },
        "image": {
          "type": "string"
        },
        "featured": {
          "type": "boolean",
          "default": false
        },
        "links": {
          "type": "array",
          "items": {
            "type": "object",
            "properties": {
              "type": {
                "type": "string",
                "enum": [
                  "github",
                  "website",
                  "demo",
                  "docs",
                  "link"
                ]
              },
              "url": {
                "type": "string",
                "format": "uri"
              },
              "label": {
                "type": "string"
              }
            },
            "required": [
              "type",
              "url",
              "label"
            ],
            "additionalProperties": false
          }
        },
        "$schema": {
          "type": "string"
        }
      },
      "required": [
        "name",
        "description",
        "tech"
      ],
      "additionalProperties": false
    }
  },
  "$schema": "http://json-schema.org/draft-07/schema#"
}